{
  "schema_version": "2.2.0",
  "generated_at": "2026-10-27T11:00:00Z",
  "source": "fixture",
  "availability": {
    "status": "available",
    "reason_code": null,
    "detail": null
  },
  "run": {
    "run_id": "m3-real-02",
    "sku": null,
    "ingesta_sha256": "aaaaaaaaaaaaaaaaaaaaaaaaaaaaaaaaaaaaaaaaaaaaaaaaaaaaaaaaaaaaaaaa",
    "run_id_m2": "m2-ejemplo",
    "identidad": "{\"codigo_version\":\"f8678bf\",\"configuracion_id\":\"config-ejemplo\",\"ingesta_ref_m1\":\"ingesta-real\",\"t_corte_reserva\":\"2026-06-30\",\"version_metricas\":\"3.4.1-inicial\",\"version_politica\":\"3.4.3-inicial\"}",
    "datos_sinteticos": false,
    "origen_declarado": true,
    "estado": "PUBLICADA",
    "causa_rechazo": null,
    "creado_en": "2026-10-27T10:00:00Z",
    "policy": {
      "version": "3.4.3-inicial",
      "n_min": 30,
      "n_min_dm": 30,
      "alfa_dm": 0.05
    },
    "publicadas_misma_identidad": [
      "m3-real-02"
    ],
    "aviso": null
  },
  "items": [
    {
      "run_id": "m3-real-02",
      "sku": "SKU-VALIDADO",
      "ingesta_sha256": "aaaaaaaaaaaaaaaaaaaaaaaaaaaaaaaaaaaaaaaaaaaaaaaaaaaaaaaaaaaaaaaa",
      "candidato_id": "SKU-VALIDADO/classical/sarima",
      "ventana": "agregada",
      "metrica": "mae",
      "valor": 2.0,
      "causa": null
    },
    {
      "run_id": "m3-real-02",
      "sku": "SKU-VALIDADO",
      "ingesta_sha256": "aaaaaaaaaaaaaaaaaaaaaaaaaaaaaaaaaaaaaaaaaaaaaaaaaaaaaaaaaaaaaaaa",
      "candidato_id": "SKU-VALIDADO/classical/sarima",
      "ventana": "agregada",
      "metrica": "rmse",
      "valor": 4.0,
      "causa": null
    },
    {
      "run_id": "m3-real-02",
      "sku": "SKU-VALIDADO",
      "ingesta_sha256": "aaaaaaaaaaaaaaaaaaaaaaaaaaaaaaaaaaaaaaaaaaaaaaaaaaaaaaaaaaaaaaaa",
      "candidato_id": "SKU-VALIDADO/classical/sarima",
      "ventana": "agregada",
      "metrica": "mase",
      "valor": null,
      "causa": "escala_cero"
    },
    {
      "run_id": "m3-real-02",
      "sku": "SKU-VALIDADO",
      "ingesta_sha256": "aaaaaaaaaaaaaaaaaaaaaaaaaaaaaaaaaaaaaaaaaaaaaaaaaaaaaaaaaaaaaaaa",
      "candidato_id": "SKU-VALIDADO/classical/sarima",
      "ventana": "agregada",
      "metrica": "me",
      "valor": -0.2,
      "causa": null
    },
    {
      "run_id": "m3-real-02",
      "sku": "SKU-VALIDADO",
      "ingesta_sha256": "aaaaaaaaaaaaaaaaaaaaaaaaaaaaaaaaaaaaaaaaaaaaaaaaaaaaaaaaaaaaaaaa",
      "candidato_id": "SKU-VALIDADO/classical/sarima",
      "ventana": "agregada",
      "metrica": "razon_sn",
      "valor": 0.8,
      "causa": null
    },
    {
      "run_id": "m3-real-02",
      "sku": "SKU-VALIDADO",
      "ingesta_sha256": "aaaaaaaaaaaaaaaaaaaaaaaaaaaaaaaaaaaaaaaaaaaaaaaaaaaaaaaaaaaaaaaa",
      "candidato_id": "SKU-VALIDADO/classical/sarima",
      "ventana": "agregada",
      "metrica": "n_pares",
      "valor": 280,
      "causa": null
    },
    {
      "run_id": "m3-real-02",
      "sku": "SKU-VALIDADO",
      "ingesta_sha256": "aaaaaaaaaaaaaaaaaaaaaaaaaaaaaaaaaaaaaaaaaaaaaaaaaaaaaaaaaaaaaaaa",
      "candidato_id": "SKU-VALIDADO/classical/sarima",
      "ventana": "agregada",
      "metrica": "n_ventanas_totales",
      "valor": 40,
      "causa": null
    },
    {
      "run_id": "m3-real-02",
      "sku": "SKU-VALIDADO",
      "ingesta_sha256": "aaaaaaaaaaaaaaaaaaaaaaaaaaaaaaaaaaaaaaaaaaaaaaaaaaaaaaaaaaaaaaaa",
      "candidato_id": "SKU-VALIDADO/classical/sarima",
      "ventana": "agregada",
      "metrica": "n_ventanas_validas",
      "valor": 40,
      "causa": null
    },
    {
      "run_id": "m3-real-02",
      "sku": "SKU-VALIDADO",
      "ingesta_sha256": "aaaaaaaaaaaaaaaaaaaaaaaaaaaaaaaaaaaaaaaaaaaaaaaaaaaaaaaaaaaaaaaa",
      "candidato_id": "SKU-VALIDADO/classical/sarima",
      "ventana": "agregada",
      "metrica": "n_pronosticos_validos",
      "valor": 40,
      "causa": null
    },
    {
      "run_id": "m3-real-02",
      "sku": "SKU-VALIDADO",
      "ingesta_sha256": "aaaaaaaaaaaaaaaaaaaaaaaaaaaaaaaaaaaaaaaaaaaaaaaaaaaaaaaaaaaaaaaa",
      "candidato_id": "SKU-VALIDADO/seasonal_naive/seasonal_naive",
      "ventana": "agregada",
      "metrica": "mae",
      "valor": 3.0,
      "causa": null
    },
    {
      "run_id": "m3-real-02",
      "sku": "SKU-VALIDADO",
      "ingesta_sha256": "aaaaaaaaaaaaaaaaaaaaaaaaaaaaaaaaaaaaaaaaaaaaaaaaaaaaaaaaaaaaaaaa",
      "candidato_id": "SKU-VALIDADO/seasonal_naive/seasonal_naive",
      "ventana": "agregada",
      "metrica": "rmse",
      "valor": 5.0,
      "causa": null
    },
    {
      "run_id": "m3-real-02",
      "sku": "SKU-VALIDADO",
      "ingesta_sha256": "aaaaaaaaaaaaaaaaaaaaaaaaaaaaaaaaaaaaaaaaaaaaaaaaaaaaaaaaaaaaaaaa",
      "candidato_id": "SKU-VALIDADO/seasonal_naive/seasonal_naive",
      "ventana": "agregada",
      "metrica": "mase",
      "valor": null,
      "causa": "escala_cero"
    },
    {
      "run_id": "m3-real-02",
      "sku": "SKU-VALIDADO",
      "ingesta_sha256": "aaaaaaaaaaaaaaaaaaaaaaaaaaaaaaaaaaaaaaaaaaaaaaaaaaaaaaaaaaaaaaaa",
      "candidato_id": "SKU-VALIDADO/seasonal_naive/seasonal_naive",
      "ventana": "agregada",
      "metrica": "me",
      "valor": 0.3,
      "causa": null
    },
    {
      "run_id": "m3-real-02",
      "sku": "SKU-VALIDADO",
      "ingesta_sha256": "aaaaaaaaaaaaaaaaaaaaaaaaaaaaaaaaaaaaaaaaaaaaaaaaaaaaaaaaaaaaaaaa",
      "candidato_id": "SKU-VALIDADO/seasonal_naive/seasonal_naive",
      "ventana": "agregada",
      "metrica": "razon_sn",
      "valor": 1.0,
      "causa": null
    },
    {
      "run_id": "m3-real-02",
      "sku": "SKU-VALIDADO",
      "ingesta_sha256": "aaaaaaaaaaaaaaaaaaaaaaaaaaaaaaaaaaaaaaaaaaaaaaaaaaaaaaaaaaaaaaaa",
      "candidato_id": "SKU-VALIDADO/seasonal_naive/seasonal_naive",
      "ventana": "agregada",
      "metrica": "n_pares",
      "valor": 280,
      "causa": null
    },
    {
      "run_id": "m3-real-02",
      "sku": "SKU-VALIDADO",
      "ingesta_sha256": "aaaaaaaaaaaaaaaaaaaaaaaaaaaaaaaaaaaaaaaaaaaaaaaaaaaaaaaaaaaaaaaa",
      "candidato_id": "SKU-VALIDADO/seasonal_naive/seasonal_naive",
      "ventana": "agregada",
      "metrica": "n_ventanas_totales",
      "valor": 40,
      "causa": null
    },
    {
      "run_id": "m3-real-02",
      "sku": "SKU-VALIDADO",
      "ingesta_sha256": "aaaaaaaaaaaaaaaaaaaaaaaaaaaaaaaaaaaaaaaaaaaaaaaaaaaaaaaaaaaaaaaa",
      "candidato_id": "SKU-VALIDADO/seasonal_naive/seasonal_naive",
      "ventana": "agregada",
      "metrica": "n_ventanas_validas",
      "valor": 40,
      "causa": null
    },
    {
      "run_id": "m3-real-02",
      "sku": "SKU-VALIDADO",
      "ingesta_sha256": "aaaaaaaaaaaaaaaaaaaaaaaaaaaaaaaaaaaaaaaaaaaaaaaaaaaaaaaaaaaaaaaa",
      "candidato_id": "SKU-VALIDADO/seasonal_naive/seasonal_naive",
      "ventana": "agregada",
      "metrica": "n_pronosticos_validos",
      "valor": 40,
      "causa": null
    }
  ],
  "page": {
    "number": 1,
    "size": 50,
    "total": 18
  }
}
